{
  "schema": 1,
  "report": "data/reports/uno/6062bee6f20a023241b626bc10d41ca18a8dd57e-d0b604895d69.json",
  "elf_digest": "82419a880f073019a39f15ba7cd79e62b470a5362e0d331c52fd0e037495eb99",
  "fbuild": "2.5.44",
  "elf_verified": true,
  "analyzed_at": "2026-10-23T09:43:43.752Z",
  "entry_address": 0,
  "disassembly": "analyzed",
  "cross_reference_table": "absent",
  "incoming_edges": 66,
  "outgoing_edges": 66,
  "object_references": 0,
  "unexplained_symbols": [
    "__vector_16 @ 0xaa0 (nm)",
    "_GLOBAL__I_65535_0_main_34d2.cpp.o.50059 @ 0xb34 (nm)",
    "_ZN2fl9platforms22fastled_watchdog_init3Ev @ 0x76 (nm)",
    "__do_global_ctors @ 0xb6 (nm)",
    "__do_copy_data @ 0x90 (nm)",
    "__vector_11 @ 0xa8c (nm)",
    "__do_clear_bss @ 0xa6 (nm)",
    "_ZTVN2fl19ClocklessControllerILh3ENS_20TIMING_WS2812_800KHZELNS_6EOrderE66ELi0ELb0ELi280EEE @ 0x80010e (nm)",
    "_ZTV8NEOPIXELILh3EE @ 0x80010e (nm)",
    "_ZL16gControllersData @ 0x800153 (nm)",
    "_ZTVN2fl14CLEDControllerE @ 0x800100 (nm)",
    "__usmulhisi3_tail @ 0xd9e (nm)",
    "_ZZN2fl20avr_time_accumulatorEvE21gTimeErrorAccum256ths @ 0x80011e (nm)"
  ],
  "unresolved_names": [
    ".do_clear_bss_start @ 0xb0",
    "L_319 @ 0x32e",
    "L_623 @ 0x672",
    "__DATA_REGION_ORIGIN__ @ 0x800060",
    "__divmodhi4_exit @ 0xd98",
    "__divmodhi4_neg1 @ 0xd8a",
    "__divmodhi4_neg2 @ 0xd92",
    "__udivmodhi4_ep @ 0xdbe",
    "__udivmodsi4_ep @ 0xd36",
    "__vectors @ 0x0",
    "_exit @ 0xde6"
  ],
  "warnings": [
    "Linker map has no Cross Reference Table."
  ]
}
