{
  "schema": 1,
  "report": "data/reports/teensy41/971beb60288dc45009d502a4bec48f8d839d40b5-d33d7f838877.json",
  "elf_digest": "1e897cae9e39c065eca53162923e76c7b95b2703e4cb7172e0283ab60aa923f7",
  "fbuild": "2.5.39",
  "elf_verified": true,
  "analyzed_at": "2026-10-09T10:03:50.120Z",
  "entry_address": 1610616832,
  "disassembly": "analyzed",
  "cross_reference_table": "absent",
  "incoming_edges": 144,
  "outgoing_edges": 144,
  "object_references": 0,
  "unexplained_symbols": [
    "txbuffer @ 0x202014a0 (nm)",
    "_ZN2fl10ObjectFLED7bitdataE @ 0x20200080 (nm)",
    "rx_buffer @ 0x202034a0 (nm)",
    "hab_csf @ 0x60006400 (nm)",
    "__malloc_av_ @ 0x20000974 (nm)",
    "digital_pin_to_info_PGM @ 0x200002a0 (nm)",
    "_VectorsRam @ 0x20001000 (nm)",
    "endpoint_queue_head @ 0x20000000 (nm)",
    "FlexSPI_NOR_Config @ 0x60000000 (nm)",
    "__atexit0 @ 0x200018c8 (nm)",
    "__sf @ 0x20001a94 (nm)",
    "_impure_data @ 0x20000768 (nm)",
    "main @ 0x2270 (nm)",
    "rx_transfer @ 0x20001460 (nm)",
    "_ZL16gControllersData @ 0x2000163c (nm)",
    "rx_event @ 0x1414 (nm)",
    "_sub_I_65535_0.0 @ 0x238c (nm)",
    "_ZZN2fl9SingletonINS_12EngineEventsELi0EE8instanceEvE8instance @ 0x2000158c (nm)",
    "usb_serial_flush_callback @ 0x89c (nm)",
    "usb_descriptor_list @ 0x20000610 (nm)",
    "tx_transfer @ 0x200013e0 (nm)",
    "dmxBuffer @ 0x20001839 (nm)",
    "_Z15_spi_dma_rxISR0v @ 0x127a (nm)",
    "flexpwm_init @ 0x4e4 (nm)",
    "_ZN8SPIClass24spiclass_lpspi4_hardwareE @ 0x200006f8 (nm)",
    "_ZNK9IPAddress7printToER5Print @ 0x15c (nm)",
    "_ZN13IntervalTimerD2Ev @ 0x22c (nm)",
    "_ZN13IntervalTimerD1Ev @ 0x22c (nm)",
    "usb_descriptor_buffer @ 0x20200000 (nm)",
    "usb_config_descriptor_480 @ 0x60001e92 (nm)",
    "usb_config_descriptor_12 @ 0x60001e30 (nm)",
    "_ZL11funct_table @ 0x200012e0 (nm)",
    "_reboot_Teensyduino_ @ 0x60001d84 (nm)",
    "SPI @ 0x20000894 (nm)",
    "__libc_init_array @ 0x25c4 (nm)",
    "_ZN2fl10ObjectFLED8dma2nextE @ 0x200017e0 (nm)",
    "_ZTV16APA102ControllerILh11ELh13EL6EOrder10ELm6000000ELN2fl26FiveBitGammaCorrectionModeE0ELm0ELm4278190080EE @ 0x20000694 (nm)",
    "quadtimer_init @ 0x556 (nm)",
    "pendablesrvreq_isr @ 0x114 (nm)",
    "_ZN10DMAChannelD2Ev @ 0xc00 (nm)",
    "_ZN10DMAChannelD1Ev @ 0xc00 (nm)",
    "microsoft_os_compatible_id_desc @ 0x20000920 (nm)",
    "__malloc_current_mallinfo @ 0x20001a60 (nm)",
    "_ZZN8CFastLED7addLedsIL12ESPIChipsets6ELh11ELh13EL6EOrder10EEER14CLEDControllerP4CRGBiiE1c @ 0x20001790 (nm)",
    "_ZTV16usb_serial_class @ 0x200006d0 (nm)",
    "ResetHandler @ 0x60001cc8 (nm)",
    "endpoint0_transfer_data @ 0x20001380 (nm)",
    "endpoint0_transfer_ack @ 0x200013a0 (nm)",
    "ImageVectorTable @ 0x60001000 (nm)",
    "_write @ 0x2110 (nm)",
    "__tcf_0 @ 0x1d0 (nm)",
    "usb_string_manufacturer_name_default @ 0x60001f0a (nm)",
    "usb_string_manufacturer_name @ 0x60001f0a (nm)",
    "systick_isr @ 0x144 (nm)",
    "usb_string_serial_number_default @ 0x200008f4 (nm)",
    "usb_string_serial_number @ 0x200008f4 (nm)",
    "usb_string_product_name_default @ 0x60001ef4 (nm)",
    "usb_string_product_name @ 0x60001ef4 (nm)",
    "microsoft_os_string_desc @ 0x20000948 (nm)",
    "device_descriptor @ 0x2000095a (nm)",
    "rx_index @ 0x2000134c (nm)",
    "rx_count @ 0x20001568 (nm)",
    "extmem_smalloc_pool @ 0x200017c0 (nm)",
    "_ZZN8SPIClass16beginTransactionE11SPISettingsE7clk_sel @ 0x20000290 (nm)",
    "_ZN6teensy23inplace_function_detail12empty_vtableIvJEEE @ 0x20000280 (nm)",
    "_ZN2fl10ObjectFLED7bitmaskE @ 0x20201480 (nm)",
    "Serial @ 0x200008e4 (nm)",
    "FastLED @ 0x20001624 (nm)",
    "_ZN2fl12EngineEventsD2Ev @ 0x134a (nm)",
    "_ZN2fl12EngineEventsD1Ev @ 0x134a (nm)",
    "BootData @ 0x60001020 (nm)",
    "qualifier_descriptor @ 0x60001f26 (nm)",
    "_fstat @ 0x219e (nm)",
    "_ZnwjSt11align_val_t @ 0x2140 (nm)",
    "_ZnajSt11align_val_t @ 0x214a (nm)",
    "rx_list @ 0x20001342 (nm)",
    "usb_cdc_line_coding @ 0x20001770 (nm)",
    "reply_buffer @ 0x20001750 (nm)",
    "endpoint0_setupdata @ 0x20001760 (nm)",
    "endpoint0_buffer @ 0x20001768 (nm)",
    "_ZN2fl10ObjectFLED4dma3E @ 0x20001830 (nm)",
    "_ZN2fl10ObjectFLED4dma2E @ 0x20001828 (nm)",
    "_ZN2fl10ObjectFLED4dma1E @ 0x20001820 (nm)",
    "_ZL10tone_timer @ 0x20000918 (nm)",
    "DMXtimer @ 0x20000910 (nm)",
    "_lseek @ 0x21ac (nm)",
    "_close @ 0x2198 (nm)",
    "usb_timer0_callback @ 0x2000174c (nm)",
    "usb_cdc_line_rtsdtr_millis @ 0x20001758 (nm)",
    "systick_safe_read @ 0x20001360 (nm)",
    "systick_millis_count @ 0x200012cc (nm)",
    "systick_cycle_count @ 0x200012c8 (nm)",
    "string0 @ 0x60001f22 (nm)",
    "scale_cpu_cycles_to_microseconds @ 0x2000135c (nm)",
    "s_roomC_hotC @ 0x20001788 (nm)",
    "s_hot_ROOM @ 0x20001784 (nm)",
    "s_hotTemp @ 0x2000177c (nm)",
    "s_hotCount @ 0x20001780 (nm)",
    "rx_available @ 0x20001564 (nm)",
    "errno @ 0x20001bcc (nm)",
    "endpointN_notify_mask @ 0x20001748 (nm)",
    "endpoint0_notify_mask @ 0x200013c0 (nm)",
    "atexit @ 0x21b6 (nm)",
    "_read @ 0x2194 (nm)",
    "_isatty @ 0x21a8 (nm)",
    "_impure_ptr @ 0x20000d84 (nm)",
    "_exit @ 0x21b2 (nm)",
    "__malloc_trim_threshold @ 0x20000d80 (nm)",
    "__malloc_top_pad @ 0x20001a90 (nm)",
    "__malloc_sbrk_base @ 0x20000d7c (nm)",
    "__malloc_max_total_mem @ 0x20001a8c (nm)",
    "__malloc_max_sbrked_mem @ 0x20001a88 (nm)",
    "__cxa_pure_virtual @ 0x58c (nm)",
    "__brkval @ 0x2000090c (nm)",
    "__atexit_recursive_mutex @ 0x2000096c (nm)",
    "__atexit @ 0x200018c4 (nm)",
    "_Znwj @ 0x212c (nm)",
    "_Znaj @ 0x2130 (nm)",
    "_ZdlPvjSt11align_val_t @ 0x215c (nm)",
    "_ZdlPvj @ 0x210c (nm)",
    "_ZdlPvSt11align_val_t @ 0x2154 (nm)",
    "_ZdlPv @ 0x2134 (nm)",
    "_ZdaPvjSt11align_val_t @ 0x2160 (nm)",
    "_ZdaPvj @ 0x213c (nm)",
    "_ZdaPvSt11align_val_t @ 0x2158 (nm)",
    "_ZdaPv @ 0x2138 (nm)",
    "_ZZN8CFastLED8countFPSEiE9lastframe @ 0x20001740 (nm)",
    "_ZZN8CFastLED8countFPSEiE2br @ 0x2000173c (nm)",
    "_ZN2fl17framebuffer_indexE @ 0x200018bc (nm)",
    "_ZN14EventResponder14firstInterruptE @ 0x200012c4 (nm)",
    "_ZN14EventResponder10firstYieldE @ 0x2000157c (nm)",
    "_ZN14CLEDController7m_pTailE @ 0x200017b8 (nm)",
    "_ZN14CLEDController7m_pHeadE @ 0x20001638 (nm)",
    "_ZN13IntervalTimer14nvic_prioritesE @ 0x20000888 (nm)",
    "_ZL8lastshow @ 0x20001634 (nm)",
    "_ZGVZN8CFastLED7addLedsIL12ESPIChipsets6ELh11ELh13EL6EOrder10EEER14CLEDControllerP4CRGBiiE1c @ 0x2000178c (nm)",
    "_ZGVZN2fl9SingletonINS_12EngineEventsELi0EE8instanceEvE8instance @ 0x20001588 (nm)",
    "Panic_Temp_isr @ 0x2108 (nm)",
    "F_CPU_ACTUAL @ 0x2000088c (nm)",
    "F_BUS_ACTUAL @ 0x20000890 (nm)",
    "leds @ 0x200017bc (nm)",
    "tx_packet_size @ 0x20001746 (nm)",
    "tx_available @ 0x200013c6 (nm)",
    "rx_packet_size @ 0x20001560 (nm)",
    "dma_channel_allocated_mask @ 0x20001582 (nm)",
    "_ZZN6teensy23inplace_function_detail6vtableIvJEEC4EvENUlPvS3_E1_4_FUNES3_S3_ @ 0x1cc (nm)",
    "_ZZN6teensy23inplace_function_detail6vtableIvJEEC4EvENUlPvS3_E0_4_FUNES3_S3_ @ 0x1ca (nm)",
    "_ZZN6teensy23inplace_function_detail6vtableIvJEEC4EvENUlPvE_4_FUNES3_ @ 0x1c8 (nm)",
    "_ZZN6teensy23inplace_function_detail6vtableIvJEEC4EvENUlPvE2_4_FUNES3_ @ 0x1ce (nm)",
    "yield_active_check_flags @ 0x20001578 (nm)",
    "usb_reboot_timer @ 0x20001779 (nm)",
    "usb_high_speed @ 0x20001744 (nm)",
    "usb_configuration @ 0x200013c4 (nm)",
    "usb_cdc_transmit_flush_timer @ 0x20001838 (nm)",
    "usb_cdc_line_rtsdtr @ 0x2000175c (nm)",
    "tx_noautoflush @ 0x200013c8 (nm)",
    "tx_head @ 0x200013c9 (nm)",
    "transmit_previous_timeout @ 0x20001584 (nm)",
    "sof_usage @ 0x20001778 (nm)",
    "rx_tail @ 0x20001340 (nm)",
    "rx_head @ 0x20001341 (nm)",
    "external_psram_size @ 0x200017bf (nm)",
    "__lock___malloc_recursive_mutex @ 0x20001a5c (nm)",
    "__lock___atexit_recursive_mutex @ 0x20001a58 (nm)",
    "_ZZN15PixelControllerIL6EOrder10ELi1ELm4294967295EE21init_binary_ditheringEvE1R @ 0x200012c0 (nm)",
    "_ZZ5yieldE7running @ 0x20001579 (nm)",
    "_ZN2fl9dma_firstE @ 0x200018c0 (nm)",
    "_ZN14EventResponder16runningFromYieldE @ 0x20001580 (nm)",
    "register_tm_clones @ 0x20 (map-derived)",
    "frame_dummy @ 0x44 (map-derived)",
    "__dso_handle @ 0x20000970 (map-derived)",
    "object.0 @ 0x20001bd0 (map-derived)"
  ],
  "unresolved_names": [
    "memset @ 0x255c"
  ],
  "warnings": [
    "Linker map has no Cross Reference Table."
  ]
}
