{
  "schema": 1,
  "report": "data/reports/uno/4880ae48cb6f9ceaefd4d15b5f25f4c43de95f4e-6d37830ad707.json",
  "elf_digest": "79faca6ee11ae18bbd182126fa46726431722ac255aaee58a600e29d1a9233c5",
  "fbuild": "2.5.42",
  "elf_verified": true,
  "analyzed_at": "2026-10-16T10:19:45.640Z",
  "entry_address": 0,
  "disassembly": "analyzed",
  "cross_reference_table": "absent",
  "incoming_edges": 140,
  "outgoing_edges": 140,
  "object_references": 0,
  "unexplained_symbols": [
    "_Z37calculate_max_brightness_for_power_mWhm @ 0x14ee (nm)",
    "_ZN8CFastLED4showEh @ 0x1800 (nm)",
    "_ZN2fl3gfx6blur1dENS_4spanINS_4CRGBELj65535EEEh.constprop.118 @ 0x6a2 (nm)",
    "_GLOBAL__I_65535_0_main_34d2.cpp.o.48593 @ 0x1aca (nm)",
    "_ZN12noise_detailL1pE @ 0x68 (nm)",
    "__vector_16 @ 0x1a36 (nm)",
    "__vector_18 @ 0x179c (nm)",
    "strip @ 0x8001d1 (nm)",
    "_ZN2fl3Pin5_initEv.constprop.53 @ 0x292 (nm)",
    "_ZN2fl3Pin10isSelectedEv @ 0x80c (nm)",
    "__vector_19 @ 0x1750 (nm)",
    "PartyColors_p @ 0x1e1 (nm)",
    "palette @ 0x80032b (nm)",
    "_ZN2fl3Pin7releaseEv @ 0x14cc (nm)",
    "_ZN2fl3Pin6selectEv @ 0x171e (nm)",
    "_ZL16gControllersData @ 0x80024b (nm)",
    "_ZL14ease8InOutQuadh @ 0x656 (nm)",
    "_ZN2fl9platforms22fastled_watchdog_init3Ev @ 0x230 (nm)",
    "spi @ 0x8001b9 (nm)",
    "__do_global_ctors @ 0x270 (nm)",
    "__do_copy_data @ 0x24a (nm)",
    "_ZTVN2fl19ClocklessControllerILh3ENS_20TIMING_WS2812_800KHZELNS_6EOrderE66ELi0ELb0ELi280EEE @ 0x800100 (nm)",
    "_ZTV7WS2812BILh3ELN2fl6EOrderE66EE @ 0x800100 (nm)",
    "_ZTV16APA102ControllerILh11ELh13ELN2fl6EOrderE136ELm2ELNS0_26FiveBitGammaCorrectionModeE0ELm0ELm4278190080EE @ 0x800116 (nm)",
    "digital_pin_to_port_PGM @ 0x1b9 (nm)",
    "digital_pin_to_bit_mask_PGM @ 0x1cd (nm)",
    "__vector_11 @ 0x1a22 (nm)",
    "_ZTVN2fl14CLEDControllerE @ 0x800134 (nm)",
    "_ZN2fl9platformsL27digital_pin_to_bit_mask_PGME @ 0x17d (nm)",
    "_ZN2fl9platformsL23digital_pin_to_port_PGME @ 0x191 (nm)",
    "_Z14serialEventRunv @ 0x4ee (nm)",
    "_ZTV14HardwareSerial @ 0x800148 (nm)",
    "__do_clear_bss @ 0x260 (nm)",
    "port_to_output_PGM @ 0x1af (nm)",
    "port_to_input_PGM @ 0x1a5 (nm)",
    "__usmulhisi3_tail @ 0x22e2 (nm)",
    "_ZN2fl9platformsL18port_to_output_PGME @ 0x169 (nm)",
    "_ZN2fl9platformsL17port_to_input_PGME @ 0x173 (nm)",
    "_ZN2flL16b_m16_interleaveE @ 0x80012c (nm)",
    "timer_millis @ 0x80015a (nm)",
    "__usmulhisi3 @ 0x22de (nm)",
    "__ashrdi3 @ 0x239c (nm)",
    "_ZZN2fl6detail25async_log_flush_timer_isrEPvE14isr_fire_count @ 0x80015e (nm)",
    "_ZZN2fl20avr_time_accumulatorEvE21gTimeErrorAccum256ths @ 0x800163 (nm)"
  ],
  "unresolved_names": [
    ".do_clear_bss_start @ 0x26a",
    "L_1136 @ 0xa74",
    "L_1440 @ 0xdb8",
    "L_1705 @ 0x1038",
    "L_3314 @ 0x1f24",
    "L_671 @ 0x738",
    "__DATA_REGION_ORIGIN__ @ 0x800060",
    "__divmodhi4_exit @ 0x22dc",
    "__divmodhi4_neg1 @ 0x22ce",
    "__divmodhi4_neg2 @ 0x22d6",
    "__udivmodhi4_ep @ 0x2404",
    "__udivmodsi4_ep @ 0x225a",
    "__vectors @ 0x0",
    "_exit @ 0x242c"
  ],
  "warnings": [
    "Linker map has no Cross Reference Table."
  ]
}
