{
  "schema": 1,
  "report": "data/reports/uno/2381daee98d53e04e7a4e57634b719be768ead90-a706ceb2eb23.json",
  "elf_digest": "2d14467bf93ecfd99359a776ae4007c47c79851d10299e40ee90ce9a642315fe",
  "fbuild": "2.5.44",
  "elf_verified": true,
  "analyzed_at": "2026-10-23T10:04:11.073Z",
  "entry_address": 0,
  "disassembly": "analyzed",
  "cross_reference_table": "absent",
  "incoming_edges": 61,
  "outgoing_edges": 61,
  "object_references": 0,
  "unexplained_symbols": [
    "__vector_16 @ 0x968 (nm)",
    "_GLOBAL__sub_I__ZN2fl6detail12gDitherFrameE @ 0x9fc (nm)",
    "_ZN2fl9platforms22fastled_watchdog_init3Ev @ 0x76 (nm)",
    "__do_global_ctors @ 0xb6 (nm)",
    "__do_copy_data @ 0x90 (nm)",
    "__vector_12 @ 0x756 (nm)",
    "__do_clear_bss @ 0xa6 (nm)",
    "_ZTV16APA102ControllerILh11ELh13ELN2fl6EOrderE10ELm2ELNS0_26FiveBitGammaCorrectionModeE0ELm0ELm4294967295EE @ 0x80010e (nm)",
    "_ZL16gControllersData @ 0x800154 (nm)",
    "_ZTVN2fl14CLEDControllerE @ 0x800100 (nm)",
    "__usmulhisi3_tail @ 0xc54 (nm)",
    "_ZZN2fl20AVRHardwareSPIOutputILh11ELh13ELm2EE10shouldWaitEbE5sWait @ 0x80011e (nm)"
  ],
  "unresolved_names": [
    ".do_clear_bss_start @ 0xb0",
    "L_377 @ 0x35c",
    "__DATA_REGION_ORIGIN__ @ 0x800060",
    "__data_end @ 0x80011e",
    "__divmodhi4_exit @ 0xc4e",
    "__divmodhi4_neg1 @ 0xc40",
    "__divmodhi4_neg2 @ 0xc48",
    "__udivmodhi4_ep @ 0xc74",
    "__udivmodsi4_ep @ 0xbec",
    "__vectors @ 0x0",
    "_exit @ 0xc9c"
  ],
  "warnings": [
    "Linker map has no Cross Reference Table."
  ]
}
