{
  "schema": 1,
  "report": "data/reports/teensy41/3d1f9fe373b295254354f6266030557a497594cf-10f4027c0c09.json",
  "elf_digest": "720a5a96b277e6921b6aa221b3903d1deff5ef87fb0022a998be9abdc8a76c04",
  "fbuild": "2.5.43",
  "elf_verified": true,
  "analyzed_at": "2026-10-22T10:10:59.861Z",
  "entry_address": 1610616832,
  "disassembly": "analyzed",
  "cross_reference_table": "absent",
  "incoming_edges": 145,
  "outgoing_edges": 145,
  "object_references": 0,
  "unexplained_symbols": [
    "txbuffer @ 0x20200080 (nm)",
    "rx_buffer @ 0x20202080 (nm)",
    "hab_csf @ 0x60006400 (nm)",
    "__malloc_av_ @ 0x2000096c (nm)",
    "digital_pin_to_info_PGM @ 0x200002a0 (nm)",
    "_VectorsRam @ 0x20001000 (nm)",
    "endpoint_queue_head @ 0x20000000 (nm)",
    "FlexSPI_NOR_Config @ 0x60000000 (nm)",
    "__atexit0 @ 0x200017d8 (nm)",
    "__sf @ 0x200019a4 (nm)",
    "_impure_data @ 0x20000768 (nm)",
    "main @ 0x21a4 (nm)",
    "rx_transfer @ 0x20001460 (nm)",
    "_ZL16gControllersData @ 0x20001638 (nm)",
    "rx_event @ 0x1518 (nm)",
    "_ZZN2fl9SingletonINS_12EngineEventsELi0EE8instanceEvE8instance @ 0x20001588 (nm)",
    "usb_serial_flush_callback @ 0x89c (nm)",
    "usb_descriptor_list @ 0x20000610 (nm)",
    "tx_transfer @ 0x200013e0 (nm)",
    "_Z15_spi_dma_rxISR0v @ 0x1278 (nm)",
    "flexpwm_init @ 0x4e4 (nm)",
    "_ZN8SPIClass24spiclass_lpspi4_hardwareE @ 0x200006f8 (nm)",
    "_ZNK9IPAddress7printToER5Print @ 0x15c (nm)",
    "_ZN13IntervalTimerD2Ev @ 0x22c (nm)",
    "_ZN13IntervalTimerD1Ev @ 0x22c (nm)",
    "usb_descriptor_buffer @ 0x20200000 (nm)",
    "usb_config_descriptor_480 @ 0x60001e92 (nm)",
    "usb_config_descriptor_12 @ 0x60001e30 (nm)",
    "_ZL11funct_table @ 0x200012e0 (nm)",
    "_sub_I_65535_0.0 @ 0x22c0 (nm)",
    "_reboot_Teensyduino_ @ 0x60001d84 (nm)",
    "SPI @ 0x20000894 (nm)",
    "__libc_init_array @ 0x24b4 (nm)",
    "_ZTV16APA102ControllerILh11ELh13ELN2fl6EOrderE10ELm6000000ELNS0_26FiveBitGammaCorrectionModeE0ELm0ELm4278190080EE @ 0x20000694 (nm)",
    "quadtimer_init @ 0x556 (nm)",
    "pendablesrvreq_isr @ 0x114 (nm)",
    "microsoft_os_compatible_id_desc @ 0x20000918 (nm)",
    "__malloc_current_mallinfo @ 0x20001970 (nm)",
    "_ZZN8CFastLED7addLedsIL12ESPIChipsets6ELh11ELh13ELN2fl6EOrderE10EEER14CLEDControllerP4CRGBiiE1c @ 0x20001790 (nm)",
    "_ZTV16usb_serial_class @ 0x200006d0 (nm)",
    "ResetHandler @ 0x60001cc8 (nm)",
    "endpoint0_transfer_data @ 0x20001380 (nm)",
    "endpoint0_transfer_ack @ 0x200013a0 (nm)",
    "ImageVectorTable @ 0x60001000 (nm)",
    "_write @ 0x20f8 (nm)",
    "__tcf_0 @ 0x1d0 (nm)",
    "usb_string_manufacturer_name_default @ 0x60001f0a (nm)",
    "usb_string_manufacturer_name @ 0x60001f0a (nm)",
    "systick_isr @ 0x144 (nm)",
    "usb_string_serial_number_default @ 0x200008f4 (nm)",
    "usb_string_serial_number @ 0x200008f4 (nm)",
    "usb_string_product_name_default @ 0x60001ef4 (nm)",
    "usb_string_product_name @ 0x60001ef4 (nm)",
    "microsoft_os_string_desc @ 0x20000940 (nm)",
    "device_descriptor @ 0x20000952 (nm)",
    "rx_index @ 0x2000134c (nm)",
    "rx_count @ 0x20001568 (nm)",
    "extmem_smalloc_pool @ 0x200017c0 (nm)",
    "_ZZN8SPIClass16beginTransactionE11SPISettingsE7clk_sel @ 0x20000290 (nm)",
    "_ZN6teensy23inplace_function_detail12empty_vtableIvJEEE @ 0x20000280 (nm)",
    "Serial @ 0x200008e4 (nm)",
    "FastLED @ 0x20001620 (nm)",
    "_ZN2fl12EngineEventsD2Ev @ 0x1246 (nm)",
    "_ZN2fl12EngineEventsD1Ev @ 0x1246 (nm)",
    "BootData @ 0x60001020 (nm)",
    "qualifier_descriptor @ 0x60001f26 (nm)",
    "_fstat @ 0x2186 (nm)",
    "_ZnwjSt11align_val_t @ 0x2128 (nm)",
    "_ZnajSt11align_val_t @ 0x2132 (nm)",
    "rx_list @ 0x20001342 (nm)",
    "usb_cdc_line_coding @ 0x20001770 (nm)",
    "reply_buffer @ 0x2000174c (nm)",
    "endpoint0_setupdata @ 0x20001760 (nm)",
    "endpoint0_buffer @ 0x20001768 (nm)",
    "_ZL10tone_timer @ 0x20000910 (nm)",
    "_lseek @ 0x2194 (nm)",
    "_close @ 0x2180 (nm)",
    "usb_timer0_callback @ 0x20001748 (nm)",
    "usb_cdc_line_rtsdtr_millis @ 0x20001754 (nm)",
    "systick_safe_read @ 0x20001360 (nm)",
    "systick_millis_count @ 0x200012cc (nm)",
    "systick_cycle_count @ 0x200012c8 (nm)",
    "string0 @ 0x60001f22 (nm)",
    "scale_cpu_cycles_to_microseconds @ 0x2000135c (nm)",
    "s_roomC_hotC @ 0x20001788 (nm)",
    "s_hot_ROOM @ 0x20001784 (nm)",
    "s_hotTemp @ 0x2000177c (nm)",
    "s_hotCount @ 0x20001780 (nm)",
    "rx_available @ 0x20001564 (nm)",
    "errno @ 0x20001adc (nm)",
    "endpointN_notify_mask @ 0x20001744 (nm)",
    "endpoint0_notify_mask @ 0x200013c0 (nm)",
    "atexit @ 0x219e (nm)",
    "_read @ 0x217c (nm)",
    "_isatty @ 0x2190 (nm)",
    "_impure_ptr @ 0x20000d7c (nm)",
    "_exit @ 0x219a (nm)",
    "__malloc_trim_threshold @ 0x20000d78 (nm)",
    "__malloc_top_pad @ 0x200019a0 (nm)",
    "__malloc_sbrk_base @ 0x20000d74 (nm)",
    "__malloc_max_total_mem @ 0x2000199c (nm)",
    "__malloc_max_sbrked_mem @ 0x20001998 (nm)",
    "__cxa_pure_virtual @ 0x58c (nm)",
    "__brkval @ 0x2000090c (nm)",
    "__atexit_recursive_mutex @ 0x20000964 (nm)",
    "__atexit @ 0x200017d4 (nm)",
    "_Znwj @ 0x2114 (nm)",
    "_Znaj @ 0x2118 (nm)",
    "_ZdlPvjSt11align_val_t @ 0x2144 (nm)",
    "_ZdlPvj @ 0x20f4 (nm)",
    "_ZdlPvSt11align_val_t @ 0x213c (nm)",
    "_ZdlPv @ 0x211c (nm)",
    "_ZdaPvjSt11align_val_t @ 0x2148 (nm)",
    "_ZdaPvj @ 0x2124 (nm)",
    "_ZdaPvSt11align_val_t @ 0x2140 (nm)",
    "_ZdaPv @ 0x2120 (nm)",
    "_ZZN8CFastLED8countFPSEiE9lastframe @ 0x2000173c (nm)",
    "_ZZN8CFastLED8countFPSEiE2br @ 0x20001738 (nm)",
    "_ZN14EventResponder14firstInterruptE @ 0x200012c4 (nm)",
    "_ZN14EventResponder10firstYieldE @ 0x2000157c (nm)",
    "_ZN14CLEDController7m_pTailE @ 0x200017b8 (nm)",
    "_ZN14CLEDController7m_pHeadE @ 0x20001634 (nm)",
    "_ZN13IntervalTimer14nvic_prioritesE @ 0x20000888 (nm)",
    "_ZL8lastshow @ 0x20001630 (nm)",
    "_ZGVZN8CFastLED7addLedsIL12ESPIChipsets6ELh11ELh13ELN2fl6EOrderE10EEER14CLEDControllerP4CRGBiiE1c @ 0x2000178c (nm)",
    "_ZGVZN2fl9SingletonINS_12EngineEventsELi0EE8instanceEvE8instance @ 0x20001584 (nm)",
    "Panic_Temp_isr @ 0x20f0 (nm)",
    "F_CPU_ACTUAL @ 0x2000088c (nm)",
    "F_BUS_ACTUAL @ 0x20000890 (nm)",
    "leds @ 0x200017bc (nm)",
    "tx_packet_size @ 0x20001742 (nm)",
    "tx_available @ 0x200013c6 (nm)",
    "rx_packet_size @ 0x20001560 (nm)",
    "_ZZN6teensy23inplace_function_detail6vtableIvJEEC4EvENUlPvS3_E1_4_FUNES3_S3_ @ 0x1cc (nm)",
    "_ZZN6teensy23inplace_function_detail6vtableIvJEEC4EvENUlPvS3_E0_4_FUNES3_S3_ @ 0x1ca (nm)",
    "_ZZN6teensy23inplace_function_detail6vtableIvJEEC4EvENUlPvE_4_FUNES3_ @ 0x1c8 (nm)",
    "_ZZN6teensy23inplace_function_detail6vtableIvJEEC4EvENUlPvE2_4_FUNES3_ @ 0x1ce (nm)",
    "yield_active_check_flags @ 0x20001578 (nm)",
    "usb_reboot_timer @ 0x20001779 (nm)",
    "usb_high_speed @ 0x20001740 (nm)",
    "usb_configuration @ 0x200013c4 (nm)",
    "usb_cdc_transmit_flush_timer @ 0x200017d0 (nm)",
    "usb_cdc_line_rtsdtr @ 0x20001758 (nm)",
    "tx_noautoflush @ 0x200013c8 (nm)",
    "tx_head @ 0x200013c9 (nm)",
    "transmit_previous_timeout @ 0x20001581 (nm)",
    "sof_usage @ 0x20001778 (nm)",
    "rx_tail @ 0x20001340 (nm)",
    "rx_head @ 0x20001341 (nm)",
    "external_psram_size @ 0x200017bf (nm)",
    "__lock___malloc_recursive_mutex @ 0x2000196c (nm)",
    "__lock___atexit_recursive_mutex @ 0x20001968 (nm)",
    "_ZZN15PixelControllerILN2fl6EOrderE10ELi1ELm4294967295EE21init_binary_ditheringEvE1R @ 0x200012c0 (nm)",
    "_ZZ5yieldE7running @ 0x20001579 (nm)",
    "_ZN14EventResponder16runningFromYieldE @ 0x20001580 (nm)",
    "register_tm_clones @ 0x20 (map-derived)",
    "frame_dummy @ 0x44 (map-derived)",
    "__dso_handle @ 0x20000968 (map-derived)",
    "object.0 @ 0x20001ae0 (map-derived)"
  ],
  "unresolved_names": [
    "memset @ 0x244c"
  ],
  "warnings": [
    "Linker map has no Cross Reference Table."
  ]
}
