{
  "schema": 1,
  "report": "data/reports/uno/6062bee6f20a023241b626bc10d41ca18a8dd57e-87221e1b6b2f.json",
  "elf_digest": "45b8dc6d5de7cc6ba8b26f758540a1cba0dd32ecddc518349f899b2ca79f8e9f",
  "fbuild": "2.5.43",
  "elf_verified": true,
  "analyzed_at": "2026-10-22T10:14:45.365Z",
  "entry_address": 0,
  "disassembly": "analyzed",
  "cross_reference_table": "absent",
  "incoming_edges": 103,
  "outgoing_edges": 103,
  "object_references": 0,
  "unexplained_symbols": [
    "_Z37calculate_max_brightness_for_power_mWhm @ 0x11b8 (nm)",
    "_ZN8CFastLED4showEh @ 0x1672 (nm)",
    "_ZN2fl3gfx6blur1dENS_4spanINS_4CRGBELj65535EEEh.constprop.80 @ 0x43a (nm)",
    "_ZN12noise_detailL1pE @ 0x68 (nm)",
    "__vector_16 @ 0x186c (nm)",
    "_GLOBAL__I_65535_0_main_34d2.cpp.o.50336 @ 0x1900 (nm)",
    "strip @ 0x800197 (nm)",
    "_ZN2fl3Pin5_initEv.constprop.38 @ 0x292 (nm)",
    "_ZN2fl3Pin10isSelectedEv @ 0x5a4 (nm)",
    "PartyColors_p @ 0x1e1 (nm)",
    "palette @ 0x800233 (nm)",
    "_ZN2fl3Pin7releaseEv @ 0x1196 (nm)",
    "_ZN2fl3Pin6selectEv @ 0x164e (nm)",
    "_ZL14ease8InOutQuadh @ 0x3ee (nm)",
    "_ZN2fl9platforms22fastled_watchdog_init3Ev @ 0x230 (nm)",
    "spi @ 0x80017f (nm)",
    "__do_global_ctors @ 0x270 (nm)",
    "__do_copy_data @ 0x24a (nm)",
    "digital_pin_to_port_PGM @ 0x1b9 (nm)",
    "digital_pin_to_bit_mask_PGM @ 0x1cd (nm)",
    "__vector_11 @ 0x1858 (nm)",
    "_ZN2fl9platformsL27digital_pin_to_bit_mask_PGME @ 0x17d (nm)",
    "_ZN2fl9platformsL23digital_pin_to_port_PGME @ 0x191 (nm)",
    "__do_clear_bss @ 0x260 (nm)",
    "_ZTVN2fl19ClocklessControllerILh3ENS_20TIMING_WS2812_800KHZELNS_6EOrderE66ELi0ELb0ELi280EEE @ 0x800100 (nm)",
    "_ZTV7WS2812BILh3ELN2fl6EOrderE66EE @ 0x800100 (nm)",
    "_ZTV16APA102ControllerILh11ELh13ELN2fl6EOrderE136ELm2ELNS0_26FiveBitGammaCorrectionModeE0ELm0ELm4294967295EE @ 0x800110 (nm)",
    "_ZL16gControllersData @ 0x800210 (nm)",
    "_ZTVN2fl14CLEDControllerE @ 0x800128 (nm)",
    "port_to_output_PGM @ 0x1af (nm)",
    "port_to_input_PGM @ 0x1a5 (nm)",
    "__usmulhisi3_tail @ 0x205c (nm)",
    "_ZN2fl9platformsL18port_to_output_PGME @ 0x169 (nm)",
    "_ZN2fl9platformsL17port_to_input_PGME @ 0x173 (nm)",
    "_ZN2flL16b_m16_interleaveE @ 0x800120 (nm)",
    "_ZZN2fl20avr_time_accumulatorEvE21gTimeErrorAccum256ths @ 0x800137 (nm)",
    "_ZZN2fl20AVRHardwareSPIOutputILh11ELh13ELm2EE10shouldWaitEbE5sWait @ 0x800136 (nm)"
  ],
  "unresolved_names": [
    ".do_clear_bss_start @ 0x26a",
    "L_1187 @ 0xd2e",
    "L_268 @ 0x4d0",
    "L_2760 @ 0x1ca6",
    "L_648 @ 0x78e",
    "L_952 @ 0xad2",
    "__DATA_REGION_ORIGIN__ @ 0x800060",
    "__data_end @ 0x800136",
    "__divmodhi4_exit @ 0x2056",
    "__divmodhi4_neg1 @ 0x2048",
    "__divmodhi4_neg2 @ 0x2050",
    "__udivmodhi4_ep @ 0x207c",
    "__udivmodsi4_ep @ 0x1fd4",
    "_exit @ 0x20a4"
  ],
  "warnings": [
    "Linker map has no Cross Reference Table."
  ]
}
