{
  "schema": 1,
  "report": "data/reports/uno/a439902ac6af64e600031c01b5c2ac0df2e690bc-a9bb0d42758b.json",
  "elf_digest": "77612cc96afff5fc20b60bbdecc7383f45a6acd94408e4dd28c946bcf80767fb",
  "fbuild": "2.5.37",
  "analyzed_at": "2026-10-07T21:58:43.937Z",
  "entry_address": 0,
  "disassembly": "analyzed",
  "cross_reference_table": "absent",
  "incoming_edges": 41,
  "outgoing_edges": 47,
  "object_references": 0,
  "unexplained_symbols": [
    "_ZN2fl19ClocklessControllerILh3ENS_20TIMING_WS2812_800KHZELNS_6EOrderE66ELi0ELb0ELi280EE10showPixelsER15PixelControllerILS2_66ELi1ELm4294967295EE",
    "_ZN19CPixelLEDControllerILN2fl6EOrderE66ELi1ELm4294967295EE4showEPKNS0_4CRGBEih",
    "_ZN19CPixelLEDControllerILN2fl6EOrderE66ELi1ELm4294967295EE9showColorERKNS0_4CRGBEih",
    "_GLOBAL__I_65535_0_main_34d2.cpp.o.52290",
    "_ZL16gControllersData",
    "_ZTVN2fl19ClocklessControllerILh3ENS_20TIMING_WS2812_800KHZELNS_6EOrderE66ELi0ELb0ELi280EEE",
    "_ZTV8NEOPIXELILh3EE",
    "_ZTVN2fl14CLEDControllerE",
    "_ZN2fl9platforms22fastled_watchdog_init3Ev",
    "__do_global_ctors",
    "__do_copy_data",
    "__do_clear_bss",
    "__usmulhisi3_tail",
    "_ZNK2fl14CLEDController4sizeEv",
    "_ZN2fl14CLEDController13beginShowLedsEi",
    "_ZNK2fl19ClocklessControllerILh3ENS_20TIMING_WS2812_800KHZELNS_6EOrderE66ELi0ELb0ELi280EE17getMaxRefreshRateEv",
    "_ZNK2fl14CLEDController24fixedWhiteChannelChipsetEv",
    "_ZNK2fl14CLEDController20staticEmitterProfileEv",
    "_ZNK2fl14CLEDController17getMaxRefreshRateEv",
    "_ZN2fl14CLEDController5lanesEv",
    "_ZN2fl14CLEDController11endShowLedsEPv",
    "_ZN19CPixelLEDControllerILN2fl6EOrderE66ELi1ELm4294967295EE5lanesEv",
    "timer_millis",
    "__cxa_pure_virtual",
    "_ZN2fl19ClocklessControllerILh3ENS_20TIMING_WS2812_800KHZELNS_6EOrderE66ELi0ELb0ELi280EE4initEv",
    "_ZN2fl14CLEDController9setSpiBusENS_11Esp32SpiBusE"
  ],
  "unresolved_names": [
    "L_625",
    "L_321",
    "__vectors",
    "__udivmodsi4_ep",
    "__udivmodhi4_ep",
    "__divmodhi4_neg1",
    "__divmodhi4_neg2",
    "__divmodhi4_exit",
    "__DATA_REGION_ORIGIN__",
    "_exit",
    ".do_clear_bss_start"
  ],
  "warnings": []
}
