{
  "schema": 1,
  "report": "data/reports/uno/dec101a1268e013ef42deee644ff58883179d61a-f8cec9378d3f.json",
  "elf_digest": "3b5d12d7a7de4dd23275d43a215cbc0fd46934628d73d8ee4a37a983fbefea61",
  "fbuild": "2.5.37",
  "analyzed_at": "2026-10-07T21:59:07.879Z",
  "entry_address": 0,
  "disassembly": "analyzed",
  "cross_reference_table": "absent",
  "incoming_edges": 36,
  "outgoing_edges": 35,
  "object_references": 0,
  "unexplained_symbols": [
    "_ZN19ClocklessControllerILh3ELi4ELi10ELi6EL6EOrder66ELi0ELb0ELi10EE10showPixelsER15PixelControllerILS0_66ELi1ELm4294967295EE",
    "_ZN19CPixelLEDControllerIL6EOrder66ELi1ELm4294967295EE4showEPK4CRGBih",
    "_ZN19CPixelLEDControllerIL6EOrder66ELi1ELm4294967295EE9showColorERK4CRGBih",
    "leds",
    "_GLOBAL__sub_I__Z19cled_contoller_sizev",
    "__do_global_ctors",
    "__do_copy_data",
    "_ZTV8NEOPIXELILh3EE",
    "_ZTV19ClocklessControllerILh3ELi4ELi10ELi6EL6EOrder66ELi0ELb0ELi10EE",
    "_ZTV14CLEDController",
    "__do_clear_bss",
    "_ZL16gControllersData",
    "__usmulhisi3_tail",
    "_ZN14CLEDController4sizeEv",
    "_ZN14CLEDController13beginShowLedsEi",
    "_ZNK19ClocklessControllerILh3ELi4ELi10ELi6EL6EOrder66ELi0ELb0ELi10EE17getMaxRefreshRateEv",
    "_ZNK14CLEDController17getMaxRefreshRateEv",
    "_ZN19CPixelLEDControllerIL6EOrder66ELi1ELm4294967295EE5lanesEv",
    "_ZN14CLEDController5lanesEv",
    "_ZN14CLEDController11endShowLedsEPv",
    "__cxa_pure_virtual",
    "_ZN19ClocklessControllerILh3ELi4ELi10ELi6EL6EOrder66ELi0ELb0ELi10EE4initEv",
    "__tcf_0",
    "_ZL21gTimeErrorAccum256ths"
  ],
  "unresolved_names": [
    "L_1130",
    "L_597",
    "L_293",
    "__vectors",
    "__udivmodsi4_ep",
    "__udivmodhi4_ep",
    "__divmodhi4_neg1",
    "__divmodhi4_neg2",
    "__divmodhi4_exit",
    "_exit",
    ".do_clear_bss_start"
  ],
  "warnings": []
}
