{
  "schema": 1,
  "report": "data/reports/uno/ebf8c2823c486158a046d8e1e682d3143580ae4e-6d37830ad707.json",
  "elf_digest": "4b60ee3389fadf21b1cb942f1eb7a63c2680864895e19f9df656b98582d782a3",
  "fbuild": "2.5.42",
  "elf_verified": true,
  "analyzed_at": "2026-10-16T10:19:59.929Z",
  "entry_address": 0,
  "disassembly": "analyzed",
  "cross_reference_table": "absent",
  "incoming_edges": 170,
  "outgoing_edges": 170,
  "object_references": 0,
  "unexplained_symbols": [
    "_Z37calculate_max_brightness_for_power_mWhm @ 0x15c8 (nm)",
    "_ZN8CFastLED4showEh @ 0x207e (nm)",
    "_ZN2fl3gfx6blur1dENS_4spanINS_4CRGBELj65535EEEh.constprop.117 @ 0x6f0 (nm)",
    "_GLOBAL__I_65535_0_main_34d2.cpp.o.54118 @ 0x235e (nm)",
    "_ZN12noise_detailL1pE @ 0x68 (nm)",
    "__vector_16 @ 0x22ca (nm)",
    "__vector_18 @ 0x201a (nm)",
    "strip @ 0x800273 (nm)",
    "_ZN2fl3Pin5_initEv.constprop.5 @ 0x292 (nm)",
    "__umulsidi3_helper @ 0x2d40 (nm)",
    "_ZN2fl3Pin10isSelectedEv @ 0x85a (nm)",
    "__vector_19 @ 0x1fce (nm)",
    "PartyColors_p @ 0x1e1 (nm)",
    "palette @ 0x8003d7 (nm)",
    "_ZN2fl3Pin7releaseEv @ 0x1f88 (nm)",
    "_ZN2fl3Pin6selectEv @ 0x1faa (nm)",
    "_ZL16gControllersData @ 0x8002ee (nm)",
    "_ZL14ease8InOutQuadh @ 0x6a4 (nm)",
    "_ZTVN2fl19ClocklessControllerILh3ENS_20TIMING_WS2812_800KHZELNS_6EOrderE66ELi0ELb0ELi280EEE @ 0x800121 (nm)",
    "_ZTV7WS2812BILh3ELN2fl6EOrderE66EE @ 0x800121 (nm)",
    "_ZTV16APA102ControllerILh11ELh13ELN2fl6EOrderE136ELm2ELNS0_26FiveBitGammaCorrectionModeE0ELm0ELm4294967295EE @ 0x80013d (nm)",
    "_ZTVN2fl14CLEDControllerE @ 0x800161 (nm)",
    "_ZN2fl9platforms22fastled_watchdog_init3Ev @ 0x230 (nm)",
    "spi @ 0x80025b (nm)",
    "__do_global_ctors @ 0x270 (nm)",
    "__do_copy_data @ 0x24a (nm)",
    "digital_pin_to_port_PGM @ 0x1b9 (nm)",
    "digital_pin_to_bit_mask_PGM @ 0x1cd (nm)",
    "__vector_11 @ 0x22b6 (nm)",
    "_ZN2fl9platformsL27digital_pin_to_bit_mask_PGME @ 0x17d (nm)",
    "_ZN2fl9platformsL23digital_pin_to_port_PGME @ 0x191 (nm)",
    "_Z14serialEventRunv @ 0x4ee (nm)",
    "_ZTV14HardwareSerial @ 0x80017b (nm)",
    "__do_clear_bss @ 0x260 (nm)",
    "port_to_output_PGM @ 0x1af (nm)",
    "port_to_input_PGM @ 0x1a5 (nm)",
    "__usmulhisi3_tail @ 0x2c84 (nm)",
    "_ZN2fl9platformsL18port_to_output_PGME @ 0x169 (nm)",
    "_ZN2fl9platformsL17port_to_input_PGME @ 0x173 (nm)",
    "_ZN2flL16b_m16_interleaveE @ 0x800159 (nm)",
    "timer_millis @ 0x800192 (nm)",
    "__umoddi3 @ 0x2d94 (nm)",
    "__ashrdi3 @ 0x2e84 (nm)",
    "_ZZN2fl6detail25async_log_flush_timer_isrEPvE14isr_fire_count @ 0x80018e (nm)",
    "_ZZN2fl20avr_time_accumulatorEvE21gTimeErrorAccum256ths @ 0x800197 (nm)"
  ],
  "unresolved_names": [
    ".do_clear_bss_start @ 0x26a",
    "L_1206 @ 0xb96",
    "L_1510 @ 0xeda",
    "L_1747 @ 0x1138",
    "L_4129 @ 0x28b8",
    "L_698 @ 0x786",
    "__DATA_REGION_ORIGIN__ @ 0x800060",
    "__divmodhi4_exit @ 0x2c72",
    "__divmodhi4_neg1 @ 0x2c64",
    "__divmodhi4_neg2 @ 0x2c6c",
    "__udivmodhi4_ep @ 0x2f22",
    "__udivmodsi4_ep @ 0x2bf0",
    "__vectors @ 0x0",
    "_exit @ 0x2f3e"
  ],
  "warnings": [
    "Linker map has no Cross Reference Table."
  ]
}
