{
  "schema": 1,
  "report": "data/reports/uno/4880ae48cb6f9ceaefd4d15b5f25f4c43de95f4e-a9bb0d42758b.json",
  "elf_digest": "48b533badd336abb12a59982ba41c92ecaf6155b764065ad064fee913b86ae6e",
  "fbuild": "2.5.37",
  "analyzed_at": "2026-10-07T21:58:43.853Z",
  "entry_address": 0,
  "disassembly": "analyzed",
  "cross_reference_table": "absent",
  "incoming_edges": 50,
  "outgoing_edges": 55,
  "object_references": 0,
  "unexplained_symbols": [
    "_ZN2fl19ClocklessControllerILh3ENS_20TIMING_WS2812_800KHZELNS_6EOrderE66ELi0ELb0ELi280EE10showPixelsER15PixelControllerILS2_66ELi1ELm4294967295EE",
    "_ZN19CPixelLEDControllerILN2fl6EOrderE66ELi1ELm4294967295EE4showEPKNS0_4CRGBEih",
    "Serial",
    "_ZN19CPixelLEDControllerILN2fl6EOrderE66ELi1ELm4294967295EE9showColorERKNS0_4CRGBEih",
    "_ZN14HardwareSerial5writeEh",
    "_GLOBAL__I_65535_0_main_34d2.cpp.o.48362",
    "_ZN5Print5writeEPKhj",
    "_ZN14HardwareSerial5flushEv",
    "_ZN14HardwareSerial4readEv",
    "_ZL16gControllersData",
    "_ZN14HardwareSerial17availableForWriteEv",
    "_ZN14HardwareSerial4peekEv",
    "_ZN2fl9platforms22fastled_watchdog_init3Ev",
    "__do_global_ctors",
    "__do_copy_data",
    "_ZTVN2fl19ClocklessControllerILh3ENS_20TIMING_WS2812_800KHZELNS_6EOrderE66ELi0ELb0ELi280EEE",
    "_ZTV8NEOPIXELILh3EE",
    "_ZTVN2fl14CLEDControllerE",
    "_Z14serialEventRunv",
    "_ZTV14HardwareSerial",
    "__do_clear_bss",
    "__usmulhisi3_tail",
    "_ZNK2fl14CLEDController4sizeEv",
    "_ZN2fl14CLEDController13beginShowLedsEi",
    "_ZNK2fl19ClocklessControllerILh3ENS_20TIMING_WS2812_800KHZELNS_6EOrderE66ELi0ELb0ELi280EE17getMaxRefreshRateEv",
    "_ZNK2fl14CLEDController17getMaxRefreshRateEv",
    "_ZN2fl14CLEDController5lanesEv",
    "_ZN2fl14CLEDController11endShowLedsEPv",
    "_ZN19CPixelLEDControllerILN2fl6EOrderE66ELi1ELm4294967295EE5lanesEv",
    "timer_millis",
    "__cxa_pure_virtual",
    "_ZZN2fl6detail25async_log_flush_timer_isrEPvE14isr_fire_count",
    "_ZN2fl19ClocklessControllerILh3ENS_20TIMING_WS2812_800KHZELNS_6EOrderE66ELi0ELb0ELi280EE4initEv"
  ],
  "unresolved_names": [
    "L_1001",
    "L_697",
    "__vectors",
    "__udivmodsi4_ep",
    "__udivmodhi4_ep",
    "__divmodhi4_neg1",
    "__divmodhi4_neg2",
    "__divmodhi4_exit",
    "__DATA_REGION_ORIGIN__",
    "_exit",
    ".do_clear_bss_start"
  ],
  "warnings": []
}
