{
  "schema": 1,
  "report": "data/reports/uno/3d1f9fe373b295254354f6266030557a497594cf-2f8d9df6d426.json",
  "elf_digest": "f3be74bd83b683e525088e8c1b1e0e71d58320eb83148f18682fa55b664f2d53",
  "fbuild": "2.5.38",
  "elf_verified": true,
  "analyzed_at": "2026-10-08T23:28:12.955Z",
  "entry_address": 0,
  "disassembly": "analyzed",
  "cross_reference_table": "absent",
  "incoming_edges": 108,
  "outgoing_edges": 108,
  "object_references": 0,
  "unexplained_symbols": [
    "_Z37calculate_max_brightness_for_power_mWhm @ 0x292 (nm)",
    "_ZN12noise_detailL1pE @ 0x68 (nm)",
    "__vector_16 @ 0x1230 (nm)",
    "_GLOBAL__I_65535_0_main_34d2.cpp.o.8814 @ 0x12c4 (nm)",
    "strip @ 0x8001bf (nm)",
    "_ZN3Pin5_initEv.constprop.0 @ 0x23c (nm)",
    "PartyColors_p @ 0x1a5 (nm)",
    "palette @ 0x800244 (nm)",
    "spi @ 0x8001a7 (nm)",
    "_ZTV7WS2812BILh3ELN2fl6EOrderE66EE @ 0x800100 (nm)",
    "_ZTV19ClocklessControllerILh3ELi4ELi10ELi6ELN2fl6EOrderE66ELi0ELb0ELi10EE @ 0x800100 (nm)",
    "_ZTV16APA102ControllerILh11ELh13ELN2fl6EOrderE136ELm2ELNS0_26FiveBitGammaCorrectionModeE0ELm0ELm4278190080EE @ 0x800116 (nm)",
    "_ZN3Pin10isSelectedEv @ 0x43e (nm)",
    "__do_global_ctors @ 0x21a (nm)",
    "__do_copy_data @ 0x1f4 (nm)",
    "_ZTV14CLEDController @ 0x800134 (nm)",
    "_ZN3Pin7releaseEv @ 0x11f0 (nm)",
    "digital_pin_to_port_PGM @ 0x17d (nm)",
    "digital_pin_to_bit_mask_PGM @ 0x191 (nm)",
    "_ZN3Pin6selectEv @ 0x1204 (nm)",
    "_ZL16gControllersData @ 0x800193 (nm)",
    "__do_clear_bss @ 0x20a (nm)",
    "__usmulhisi3_tail @ 0x1cb4 (nm)",
    "port_to_output_PGM @ 0x173 (nm)",
    "port_to_input_PGM @ 0x169 (nm)",
    "_ZL16b_m16_interleave @ 0x80012c (nm)",
    "_ZZN8CFastLED8countFPSEiE9lastframe @ 0x80018d (nm)",
    "_ZL8lastshow @ 0x8001a3 (nm)",
    "__usmulhisi3 @ 0x1cb0 (nm)",
    "_ZZN8CFastLED8countFPSEiE2br @ 0x800191 (nm)",
    "_ZZN20AVRHardwareSPIOutputILh11ELh13ELm2EE10shouldWaitEbE5sWait @ 0x800148 (nm)",
    "_ZL21gTimeErrorAccum256ths @ 0x800149 (nm)"
  ],
  "unresolved_names": [
    ".do_clear_bss_start @ 0x214",
    "L_1020 @ 0xb24",
    "L_1285 @ 0xda4",
    "L_223 @ 0x480",
    "L_2534 @ 0x1894",
    "L_716 @ 0x7e0",
    "__data_end @ 0x800148",
    "__divmodhi4_exit @ 0x1c4c",
    "__divmodhi4_neg1 @ 0x1c3e",
    "__divmodhi4_neg2 @ 0x1c46",
    "__udivmodhi4_ep @ 0x1cea",
    "__udivmodsi4_ep @ 0x1c74",
    "_exit @ 0x1d12"
  ],
  "warnings": [
    "Linker map has no Cross Reference Table."
  ]
}
